{
  "id": "cuba",
  "name": "Cuba",
  "region": "Caribbean",
  "coordinates": [21.5218, -77.7812],
  "overview": {
    "summary": "Cuba's rich Afro-Cuban culture has profoundly influenced music, dance, and spiritual practices worldwide. With a significant population of African descent, Cuba has created unique cultural expressions that blend Yoruba, Congo, and other African traditions with Spanish colonial influences.",
    "historicalContext": "Between 1511 and 1886, Cuba received nearly one million enslaved Africans, making it one of the last countries in the Americas to abolish slavery. The island's sugar plantation economy created conditions where African cultural practices could be preserved and transformed into distinctly Cuban expressions.",
    "populationStats": {
      "population": "11.3 million",
      "percentage": "35% of African descent",
      "historicalPeriod": "1511-1886",
      "keyFacts": [
        "One of the last countries to abolish slavery (1886)",
        "Birthplace of salsa, mambo, and rumba music",
        "Strong preservation of Yoruba religious traditions (Santería)",
        "Major influence on Latin American and world music"
      ]
    }
  },
  "culturalElements": {
    "music": [
      {
        "name": "Rumba",
        "description": "Traditional Afro-Cuban music and dance complex featuring drums, vocals, and expressive movement.",
        "africanRoots": "Based on Central African and Yoruba rhythmic patterns and call-and-response vocals",
        "examples": ["Guaguancó", "Yambú", "Columbia styles"],
        "significance": "Represents pure African musical expression adapted to Cuban urban environment"
      },
      {
        "name": "Salsa",
        "description": "Popular dance music that evolved from Cuban son and other Afro-Cuban rhythms.",
        "africanRoots": "Built on African polyrhythmic foundation with clave rhythm as organizing principle",
        "examples": ["Cuban son", "Mambo evolution", "International salsa"],
        "significance": "Spread Afro-Cuban musical concepts throughout Latin America and the world"
      },
      {
        "name": "Santería Music",
        "description": "Sacred music used in Yoruba-derived religious ceremonies and rituals.",
        "africanRoots": "Direct continuation of Yoruba religious music and ceremonial drumming",
        "examples": ["Batá drumming", "Orisha songs", "Religious ceremonies"],
        "significance": "Maintains African spiritual music traditions and religious practices"
      },
      {
        "name": "Conga",
        "description": "Street carnival music featuring large drums and participatory dancing.",
        "africanRoots": "Derives from Central African processional music and community celebrations",
        "examples": ["Carnival parades", "Street festivals", "Community celebrations"],
        "significance": "Preserves African communal music-making and festival traditions"
      }
    ],
    "food": [
      {
        "name": "Moros y Cristianos",
        "description": "Black beans and rice dish that represents the fusion of African and Spanish culinary traditions.",
        "africanRoots": "Bean preparation methods and one-pot cooking techniques from West Africa",
        "examples": ["Daily meals", "Family gatherings", "Restaurant staple"],
        "significance": "Symbolizes cultural fusion while maintaining African nutritional wisdom"
      },
      {
        "name": "Tostones",
        "description": "Twice-fried plantains served as a popular side dish throughout Cuba.",
        "africanRoots": "Plantain preparation techniques brought from West and Central Africa",
        "examples": ["Street food", "Restaurant appetizer", "Home cooking"],
        "significance": "Demonstrates African agricultural knowledge and cooking methods"
      },
      {
        "name": "Yuca con Mojo",
        "description": "Cassava root served with garlic and citrus sauce.",
        "africanRoots": "Cassava processing and preparation methods from African culinary traditions",
        "examples": ["Traditional meals", "Holiday celebrations", "Family recipes"],
        "significance": "Maintains African knowledge of root vegetable preparation and nutrition"
      }
    ],
    "religion": [
      {
        "name": "Santería (Regla de Ocha)",
        "description": "Syncretic religion that preserves Yoruba spiritual practices within Catholic framework.",
        "africanRoots": "Direct continuation of Yoruba religious system with orisha worship and divination",
        "examples": ["Orisha ceremonies", "Spiritual consultations", "Religious festivals"],
        "significance": "Maintains African spiritual worldview and religious practices in the Americas"
      },
      {
        "name": "Palo Monte",
        "description": "Afro-Cuban religion based on Central African (Congo) spiritual traditions.",
        "africanRoots": "Preserves Bantu religious practices including ancestor worship and natural spirits",
        "examples": ["Nganga ceremonies", "Spiritual healing", "Ancestral communication"],
        "significance": "Maintains Central African spiritual traditions and healing practices"
      },
      {
        "name": "Abakuá",
        "description": "Secret society based on West African (Calabar) fraternal organizations.",
        "africanRoots": "Direct continuation of Efik and Ejagham secret society traditions from Nigeria/Cameroon",
        "examples": ["Initiation ceremonies", "Community support", "Cultural preservation"],
        "significance": "Preserves African social organization and masculine spiritual traditions"
      }
    ],
    "language": [
      {
        "name": "Afro-Cuban Spanish",
        "description": "Cuban Spanish enriched with vocabulary and expressions from African languages.",
        "africanRoots": "Incorporates words and concepts from Yoruba, Kikongo, and other African languages",
        "examples": ["Religious terminology", "Musical vocabulary", "Cultural expressions"],
        "significance": "Demonstrates African linguistic influence on Cuban Spanish"
      },
      {
        "name": "Lucumí Language",
        "description": "Liturgical language used in Santería ceremonies, derived from Yoruba.",
        "africanRoots": "Direct preservation of Yoruba language for religious and ceremonial purposes",
        "examples": ["Religious chants", "Orisha names", "Ceremonial prayers"],
        "significance": "Maintains African sacred language and religious terminology"
      }
    ],
    "festivals": [
      {
        "name": "Carnival",
        "description": "Annual celebration featuring Afro-Cuban music, dance, and cultural expressions.",
        "africanRoots": "Incorporates African masquerade traditions and community celebration patterns",
        "examples": ["Havana Carnival", "Santiago Carnival", "Conga parades"],
        "significance": "Showcases Afro-Cuban culture and maintains African festival traditions"
      },
      {
        "name": "Día de San Lázaro",
        "description": "Religious festival honoring Saint Lazarus (syncretized with Yoruba orisha Babalú-Ayé).",
        "africanRoots": "Combines Catholic saint veneration with Yoruba orisha worship traditions",
        "examples": ["El Rincón pilgrimage", "Healing ceremonies", "Religious offerings"],
        "significance": "Demonstrates African religious syncretism and spiritual continuity"
      }
    ]
  },
  "media": {
    "featuredImage": {
      "id": "cuba-featured",
      "url": "https://images.unsplash.com/photo-1544551763-46a013bb70d5?ixlib=rb-4.0.3&ixid=M3wxMjA3fDB8MHxwaG90by1wYWdlfHx8fGVufDB8fHx8fA%3D%3D&auto=format&fit=crop&w=2070&q=80",
      "alt": "Cuban salsa dancers performing in traditional colorful costumes",
      "caption": "Cuban salsa and rumba carry African rhythms and expressions to the world",
      "type": "image"
    },
    "gallery": [
      {
        "id": "cuba-santeria",
        "url": "https://images.unsplash.com/photo-1578662996442-48f60103fc96?ixlib=rb-4.0.3&ixid=M3wxMjA3fDB8MHxwaG90by1wYWdlfHx8fGVufDB8fHx8fA%3D%3D&auto=format&fit=crop&w=2070&q=80",
        "alt": "Santería ceremony with traditional white clothing and offerings",
        "caption": "Santería preserves Yoruba spiritual traditions within Cuban culture",
        "type": "image"
      },
      {
        "id": "cuba-drums",
        "url": "https://images.unsplash.com/photo-1604909052743-94e838986d24?ixlib=rb-4.0.3&ixid=M3wxMjA3fDB8MHxwaG90by1wYWdlfHx8fGVufDB8fHx8fA%3D%3D&auto=format&fit=crop&w=2070&q=80",
        "alt": "Traditional Cuban batá drums used in Santería ceremonies",
        "caption": "Batá drums maintain the sacred rhythms of Yoruba religious traditions",
        "type": "image"
      },
      {
        "id": "cuba-carnival",
        "url": "https://images.unsplash.com/photo-1516975080664-ed2fc6a32937?ixlib=rb-4.0.3&ixid=M3wxMjA3fDB8MHxwaG90by1wYWdlfHx8fGVufDB8fHx8fA%3D%3D&auto=format&fit=crop&w=2070&q=80",
        "alt": "Cuban carnival celebration with elaborate costumes and masks",
        "caption": "Cuban carnival showcases the vibrant fusion of African and Caribbean cultures",
        "type": "image"
      }
    ]
  },
  "connections": {
    "africanOrigins": ["Nigeria", "Congo", "Angola", "Ghana", "Benin", "Cameroon"],
    "relatedLocations": ["haiti", "jamaica", "brazil", "colombia", "usa"]
  }
}